Filing_Name	Jurisdiction	Regulator	Firm_Type	Frequency	Days_From_Today	Due_Date	Status	Owner_Email	Description	Assigned_To
Form N-1A Annual Update	US	SEC	Open-Ended Fund	Annual	57	8/25/2026	Pending	compliance@example.com	Annual registration statement update for open-end mutual funds.	Sarah Mitchell
Form N-CSR	US	SEC	Registered Investment Company	Semi-Annual	-21	6/8/2026	Submitted	reporting@example.com	Certified shareholder report filed by registered management investment companies.	James Okafor
Form N-PX	US	SEC	Registered Investment Company	Annual	66	9/3/2026	Pending	proxy@example.com	Annual report of proxy voting record for registered funds.	Sarah Mitchell
Form 13F	US	SEC	Institutional Investment Manager	Quarterly	50	8/18/2026	Submitted	trading@example.com	Quarterly report of equity holdings by institutional investment managers with over $100m AUM.	Daniel Reyes
Form NPORT-P	US	SEC	Registered Investment Company	Monthly	1	6/30/2026	Submitted	portfolio.reporting@example.com	Monthly portfolio holdings report filed by registered open-end funds.	James Okafor
Form N-CEN	US	SEC	Registered Investment Company	Annual	78	9/15/2026	Pending	fund.admin@example.com	Annual census report providing structural and operational data about registered investment companies.	Sarah Mitchell
Form N-2	US	SEC	Closed-End Fund	As Required	94	10/1/2026	Pending	closedend@example.com	Registration statement for closed-end management investment companies.	Priya Nair
Form 486APOS	US	SEC	Open-Ended Fund	As Required	-4	6/25/2026	Pending	legal@example.com	Post-effective amendment to registration statement for open-end funds under the 1940 Act.	Priya Nair
Form ADV Annual Update	US	SEC	Investment Adviser	Annual	93	9/30/2026	Pending	adviser.compliance@example.com	Annual update to Form ADV for registered investment advisers disclosing business practices and conflicts.	Sarah Mitchell
Form PF	US	SEC	Private Fund Adviser	Quarterly	61	8/29/2026	Pending	private.funds@example.com	Reporting form for private fund advisers to provide systemic risk data to the SEC and FSOC.	Daniel Reyes
Form D	US	SEC	Private Fund Adviser	As Required	108	10/15/2026	Pending	legal@example.com	Notice of exempt offering of securities filed within 15 days of first sale.	Priya Nair
Schedule 13G	US	SEC	Institutional Investment Manager	Annual	73	9/10/2026	Pending	trading@example.com	Passive beneficial ownership report for investors holding over 5% of a registered class.	Daniel Reyes
CASS Client Assets Report	UK	FCA	Investment Firm	Monthly	17	7/16/2026	Overdue	cass.team@example.com	Monthly report on client money and safe custody assets under the Client Assets Sourcebook.	Tom Walsh
COREP Capital Adequacy	UK	FCA	Investment Firm	Quarterly	80	9/17/2026	Pending	risk@example.com	Common Reporting framework for capital requirements under CRD IV/CRR.	Tom Walsh
MiFIR Transaction Report	UK	FCA	Investment Firm	Daily	1	6/30/2026	Pending	trading.ops@example.com	Daily report of trades executed to the FCA to ensure market transparency under MiFID II.	Aisha Brennan
AIFMD Annex IV	UK	FCA	Alternative Investment Fund Manager	Quarterly	32	7/31/2026	Pending	aifm.reporting@example.com	Detailed reporting on fund exposures liquidity leverage and risk profiles under the AIFMD.	Tom Walsh
EMIR Trade Repository Report	UK	FCA	Investment Firm	Daily	0	6/29/2026	Submitted	derivatives@example.com	Daily reporting of OTC and exchange-traded derivative contracts to a registered trade repository.	Aisha Brennan
SMCR Annual Certification	UK	FCA	Investment Firm	Annual	124	10/31/2026	Pending	hr.compliance@example.com	Annual fitness and propriety certification for all Certified Persons under the Senior Managers and Certification Regime.	Tom Walsh
ICARA Process Review	UK	FCA	Investment Firm	Annual	154	11/30/2026	Pending	risk@example.com	Internal Capital and Risk Assessment document required under IFPR for MiFID investment firms.	Tom Walsh
FCA REP018 Complaints Report	UK	FCA	Investment Firm	Semi-Annual	63	8/31/2026	Pending	complaints@example.com	Biannual report of complaints received and resolved submitted to the FCA.	Aisha Brennan
Confirmation Statement	UK	Companies House	All Limited Companies	Annual	107	10/14/2026	Pending	legal@example.com	Annual confirmation that company details on the register are accurate including directors and shareholders.	Priya Nair
PSC Register Update	UK	Companies House	All Limited Companies	As Required	33	8/1/2026	Submitted	legal@example.com	Notification of changes to the register of Persons with Significant Control.	Priya Nair
Annual Accounts Filing	UK	Companies House	All Limited Companies	Annual	93	9/30/2026	Pending	finance@example.com	Statutory annual accounts filed with Companies House within 9 months of financial year end.	Marcus Chen
VAT Return	UK	HMRC	All VAT-Registered Entities	Quarterly	32	7/31/2026	Submitted	finance@example.com	Quarterly VAT return submitted to HMRC reporting output and input tax.	Marcus Chen
Corporation Tax Return CT600	UK	HMRC	All Limited Companies	Annual	185	12/31/2026	Pending	finance@example.com	Annual corporation tax return filed with HMRC within 12 months of the accounting period end.	Marcus Chen
PAYE Real Time Information	UK	HMRC	All Employers	Monthly	0	6/29/2026	Submitted	payroll@example.com	Monthly Full Payment Submission reporting employee pay and deductions to HMRC in real time.	Marcus Chen
FINREP Financial Reporting	UK	FCA	Retail Bank/Investment Firm	Quarterly	63	8/31/2026	Pending	finance.reporting@example.com	Financial reporting framework for credit institutions and investment firms under IFRS.	Marcus Chen
CPO-PQR	US	CFTC	Commodity Pool Operator	Quarterly	47	8/15/2026	Pending	cpo.reporting@example.com	Quarterly pool and performance report filed by registered commodity pool operators with the NFA.	Daniel Reyes
Form 40	US	CFTC	Foreign Trader	As Required	-9	6/20/2026	Pending	trading@example.com	Statement of reporting trader identifying large position holders in CFTC-regulated markets.	Daniel Reyes
Large Trader Report	US	CFTC	Investment Firm	Daily	0	6/29/2026	Submitted	trading.ops@example.com	Daily report of large trader positions in futures and options markets submitted to the CFTC.	Daniel Reyes
NFA Annual Questionnaire	US	NFA	Futures Commission Merchant	Annual	94	10/1/2026	Pending	compliance@example.com	Annual self-examination questionnaire submitted by NFA members to demonstrate ongoing compliance.	Sarah Mitchell
485BPOS	US	SEC	Open-Ended Fund	Annual	0	6/29/2026	Submitted	compliance@example.com	A post-effective amendment to a previously filed registration statement, reporting updates to the SEC on a securities offering	Sarah Mitchell
Form 13F	US	SEC	Institutional Investment Manager	Quarterly	141	11/17/2026	Pending	trading@example.com	Quarterly report of equity holdings by institutional investment managers with over $100m AUM.	Daniel Reyes
Form NPORT-P	US	SEC	Registered Investment Company	Monthly	31	7/30/2026	Pending	portfolio.reporting@example.com	Monthly portfolio holdings report filed by registered open-end funds.	James Okafor
VAT Return	UK	HMRC	All VAT-Registered Entities	Quarterly	123	10/30/2026	Pending	finance@example.com	Quarterly VAT return submitted to HMRC reporting output and input tax.	Marcus Chen
PAYE Real Time Information	UK	HMRC	All Employers	Monthly	30	7/29/2026	Pending	payroll@example.com	Monthly Full Payment Submission reporting employee pay and deductions to HMRC in real time.	Marcus Chen
Large Trader Report	US	CFTC	Investment Firm	Daily	-3	6/26/2026	Submitted	trading.ops@example.com	Daily report of large trader positions in futures and options markets submitted to the CFTC.	Daniel Reyes
Form N-CSR	US	SEC	Registered Investment Company	Semi-Annual	161	12/7/2026	Pending	reporting@example.com	Certified shareholder report filed by registered management investment companies.	James Okafor
Large Trader Report	US	CFTC	Investment Firm	Daily	1	6/30/2026	Pending	trading.ops@example.com	Daily report of large trader positions in futures and options markets submitted to the CFTC.	Daniel Reyes
Large Trader Report	US	CFTC	Investment Firm	Daily	0	6/29/2026	Submitted	trading.ops@example.com	Daily report of large trader positions in futures and options markets submitted to the CFTC.	Daniel Reyes
EMIR Trade Repository Report	UK	FCA	Investment Firm	Daily	1	6/30/2026	Pending	derivatives@example.com	Daily reporting of OTC and exchange-traded derivative contracts to a registered trade repository.	Aisha Brennan
485BPOS	US	SEC	Open-Ended Fund	Annual	365	6/29/2027	Pending	compliance@example.com	A post-effective amendment to a previously filed registration statement, reporting updates to the SEC on a securities offering	Sarah Mitchell
